id,text,label
357,segera negara kita indonesia harus segera benar mandiri dibidang pangan alutista bbm gas energi lainnya,neutral
358,kita ini negara yang hidup dari konsumsi meskipun kita juga memproduksi pangan energi yang besar namun mengingat bahwa jumlah penduduk kita juga besarga bisa hanya berbangga namun semua harus waspada lonjakan harga tentu menjadi pukulan yang telak bagi semua kalangan masyarakat urusan perut urusan ekonomi yang sangat sangat penting ini jangan sampai terhambatsmoga perjuangan pemerintah di ajang enggak dikonkritkan,positive
359,Dia memakan susu indomilk di dalam kulkas,neutral
360,kok benar ya kata bossman mardigu habis covidada perang cuacasetelah itu pasti krisis pangan jadinya,negative
361,Seharusnya masih berhak mendapatkan cahsback j uta dengan cara berlangganan paket iplan k selama bulan kak Dan bisa juga cicilan menggunakan cc bca bni mandiri cimb niaga,neutral
362,indonesia kuat karena kayak akan sda dan tanah yang terhampar luasdan rakyat indonesia pekerja keras terutama dari rakyat biasa para kuli petani buruh tanitukg cetak bata batako pdagang kecil keliling kakidl begitu juga tki tkw tetap bkrj kras mendulang devisa dinegri orgmaka jangan sia kan wong cilik apalagi meremehkan dan menghina wong ciliksiapa yang menghina wong cilik akan kuwalat dan tersungkur dengan sendirinya,negative
363,kalau sampai krisis pangan indonesia saat ini masih jauh sebab di indonesia masih turun hujan sehingga para petani masih bisa cocok tanam kecuali ada mafia pangandari indonesia di kirim ke luar yang sedang krisis panganitu yang di waspadai karena eropa di ambang krisis pangan,negative
364,padahal umr kemarin naik enggak sampai,neutral
365,atur saja di data sama di lapangan sudah beda jauh sudah banyak umkm drop dan sekarang ekonomi lagi lesu,negative
366,Restoran unik dengan menu nasi goreng yang unik pula Nasi goreng disajikan dengan level kepedasan yang berbeda beda Anda penggemar pedas harus mencoba nasi goreng di sini Selain itu nasi goreng disajikan dengan berbagai resep seperti dengan ebi kemangi kecap manis bumbu rahasia sampai dengan campuran kencur Per porsi disajikan dengan takaran yang pas Harga per porsinya mulai rp rp Pelayanan sangat menyenangkan,positive
367,indonesia punya sumber daya alam yang besar kenapa tidak diberdayakan secara maksimal,positive
368,jangan cuma berkata waspada kita pernah jadi negara agraris majukan pertanian buat para petani sejahtera,negative
369,Aku dan suami biasanya menginap di jimbaran saat berkunjung ke bali,neutral
370,Bingung mau makan ke mana yang tempatnya asik makanan enak dan harga terjangkau Ke sini saja Saya dan pasangan sangat menikmati Pengunjung kebanyakan anak muda jadi ikutan merasa muda lagi,positive
371,tahu lalu tanpa impor bahan pangan pun kita masih bisa survive kenapa sekarang tidak,neutral
372,sri mu langka,negative
373,Bulan januari saya sudah ke galeri indosat untuk registrasi kartu kata mbaknya yang tas sudah teregistrasi kok tapi kemarin tidak bisa telepon dan sms karena diblokir belum registrasi Maunya apa coba Terima kasih atas layanannya yang excellent sekali,negative
374,lah memang sudah naik,negative
375,Parah banget xl deh sekarang sepertinya harus ganti provider lain cuma mahal doang kualitas jelek,negative
376,indonesia subur untuk tumbuhan pangan padi subur jagung subur ikan di lautan indonesia luas insya allah pangan di indonesia aman jika pemerintah pemikiran nya tepat,positive
377,Saya dan sodara istri saya sedang menghabiskan waktu di palembang Saya mencari tempat makan dan bertemulah bakmi jogya Setelah masuk terkejutlah karena saya harus mencari tempat duduk dan mencari tempat yang kosong saya terlantar selama menit Setelah memesan dengan menu mi godok Lagi saya menunggunya sejam dan ini membuat saya hilang selera makan itu pun ditanyakan ke tukang masak,negative
378,apbn memang memiliki windfal dari batu bara dan cpotapi rakyat sama sekali tidak memiliki windfal bu sriuntuk bisa menyeimbangkan neraca ekonomi rumah tangganya harga naikpajak naiktapi gaji tidak naikpendapatan pemasukan tidak naik tabungan masyarakat perlahan tapi pasti terkuras tolong di fikirkan itu,negative
379,kalo harga sudah naik biasanya susah turunjika turun pun tidak sepenuhnya ke harga awal sedangkan pendapatan tidak naik itu memberatkan kalangan menengah kebawah,negative
380,selama negara amerika dan negara negara eropanatomelakukan provokasi perang terhadap negara mana pun khususnya negara rusia dan negara chinamaka pertemuan pada enggak tidak ada artinyatidak menghasilkan solusi apapun sebaiknya negara negara anggota enggak harusnya menekan negara negara anggota nato agar memilih hidup damaisupaya gejolak keuangan tidak terjadi bukan kah hidup damai itu lebih baik,negative
381,Kalau ke semarang wajib makan mie kocok ini menurut saya paling enak Walaupun tempatnya dipinggiran ruko dan untuk makannya mesti berusaha untuk dapatkan bangku tapi layak banget kalau dibandingkan rasanya Kikilnya banyak kuahnya gurih banget dan mienya lebar dan tipis Harganya juga terjangkau Teh terbaik mie kocok di semarang,positive
382,Hampir lebih kali saya ke sini Dim sumnya yahud dan harganya terjangkau banget Tempatnya asyik dan sangat nyaman Pelayannya ramah walaupun kita cuma berdua dan makan tidak banyak jenisnya Pokoknya rekomendasi banget bila mencari dim sum atau shabu di balikpapan,positive
383,gara gara sanksi barat yang ikut campur perang rusia ukraina,negative
384,semua naikgajisyukiri saja lahyg penting halal,positive
385,anjeng,negative
386,solusinya segera dan sangat mendesak untuk buka lahan pertanian baru,neutral
387,tenang saja bu rakyat indonesia tegarmau resesi mau krisis apalah namanya memang sudah biasa kebal,negative
388,apa beda nya masa penjahan kalo begitu,negative
389,Dapatkan hardisk dengan harga promo untuk setiap pemesanan jasa isi hardisk penuh tb,neutral
390,kenapa ikutan bodoh padahalpadahal lahan kita masih luasuntuk bertanamkalo pertanian majupangan murah,negative
391,ambil short btc lah hehe,neutral
392,Meningkatnya presentase peminat ride sharing membuat toyota nekad menggelontorkan uang hingga miliar pada grab demi menyelamatkan bisnis otomotifnya,neutral
393,Dulu suka banget makan di sini waktu sama di jakarta baru tahu kalau di bandung juga ada Tempatnya enak banget Banyak pilihan suasana yang bisa dipilih mau di luar indoor merokok atau ngge tidak ada tempat buat segala jenis pengunjung Makanannya juga enak sih Ya pasta pasta ala orang indonesia,positive
394,Tempat yang indah dan romantis dengan pemandangan kota bandung dengan kerlip lampunya yang mirip dengan ribuan cahaya lilin di malam hari serta hawa dingin pegunungan Apalagi hidangan yang lezat hangat dan penampilan yang sangat menggoda Wah sangat sayang jika dilewatkan,positive
395,bagus hargamkin naik rakyt makin menjeritapa sih manpaat nya pemerintah buat wong cilikpara media seharusnya ikut mengasih saran ke pemerintahikut prihatin jangan hanya memberitaknnya sajacoba dong untuk ikut andil angkat kluh kesah rakyt dari lapangan atau dari kehidupan rakyt dari kampung cobalah untuk lebih maju dan kreatip awak media rakyt membutuh anda imbang dong begini dari pemerintah sah saja yang di britaknnya itu trimksh,negative
396,kisah sinetron nya begini mendag lutfi gagal tangani migor jokowi tunjuk luhut untuk tangani migor jokowi pecat lutfi sebagai mendag jokowi angkat zulhas sebagai mendag baru zulhas serahkan urusan migor ke luhutlah ujung ujung luhut jugaini mah namanya apa kabar otak,negative
397,Aslinya ini basa berada di jalan karapitan setahu saya sekarang memenag sudah tersebar di beberapa tempat di bandung Makanannya juga tidak hanya bakso tetapi ada beberapa makanan tambahan yang lain Untuk rasa juga tidak terlalu spesial Untuk harga dengan ukuran harga bakso di bandung cukup mahal Ditambah pelayannannya yang kurang bagus di ciwalk,negative
398,sip ekonomi indonesia meroketkatanya,positive
399,Steak sebenar benarnya steak especially chiken cordon bulenya yang bikin kangen plus makan yang diselimuti pemandangan bandung yang top markotop Pas banget datangnya malam ya dengan pasangan bagaimana pun dengan keluarga juga tetap asyik Jalan menuju ke lokasi memang berli ku perlu usaha dan kerja keras,positive
400,pusingkerja enggak cari makin susah,negative
401,dartocaridemsayudiditdewirahayu gembong gembong teroris garong begal maling penzinah muhson segera lakukan pengebreman penembakan penangkapan dan penggrebekan secepatnya di desa kedondong kec patrol kab indramayu,negative
402,bagi rakyat gejolak harga terasa beratbagi pejabat ya enggak ngefek,negative
403,wapres lagi ngopi,neutral
404,pada naik karena faktor cuaca bos,negative
405,Menurut saya makan di sini porsinya banyak dan harganya murah terus makannya cepat datangnya lagi dan tempatnya juga bersih dan luas,positive
406,rezim kbanyak an ngutang katanya jadi president indonesia akan makmur bahan pokok enggak naik lebih parah dari penjajah enak an zaman pak surabaya apa murah,negative
407,palagi kalo bbm naik pertalit deh di batasi pengirimnya tiap spbu,neutral
408,yang merampok bikin u dungu menipu menganiaya ribuan pendemo bunuh tembak merekayasa ribuan kasus mavia bisnis covid tebar hoaxfitnahrezimyg di tangkap masyarakatajaib tapi,negative
409,yang berhutang elit rezim yang di paksa membayar rakyatdgn cara naikin pajak bbmlistrikbpjs dlsbnyadungu akut,negative
410,Dia ketahuan bikin indomie goreng jumbo padahal kan kalau itu tidak kenyang,neutral
411,asal jangan di bawa ke luar negeri ajakasihan nanti masyarakat indonesiadi negara luar kan lagi krisis pangan lagi pada engap kayak mujaer kena cingkalim,negative
412,Obat tanpa resep sebaiknya dihindari ibu menyusui,neutral
413,akibat pemerintahan di isi orang serakah yang goblok,negative
414,uang nya dikorupsi oleh anggota nasdemsemoga saja kedepannya dapat pengganti yang bisa mengurusmelanjutkan program itu,negative
415,Saya sudah konfirmasi ke pihak gramedia tapi dilempar lempar tak ada kejelasan Pihak gramed sampai spv di outlet tersebut saling lempar dan menyebut tidak ada promo Kecewa dilempar lempar begitu,negative
416,maklum mau pemilu proyek percuanan digalakan,negative
417,Mau bikin postingan yang isinya mengedukasi customers gojek,neutral
418,presidenya tolol ya begini jadinyayg ada malah kerusakan kerusakan dimana manakerusakan di segala bidangakibat ketololan seorang pemimpin negara,negative
419,Waktu datang ke sini sedang bukan musim stroberi jadi pada kecil kecil dan tidak bagus Jadi cuma ambil seadanya saja sad,negative
420,gila betul ya pemerintahan jokowiininanem singkong saja gagal cuk wkwkwk,negative
421,babat hutandapat cuan dari jual pohonnya terus tanam singkong pasti dibikin gagalsehingga dari pada tidak di manfaat kan lahan di olah jadi tambang pasir dan batu granitcuan gede,positive
422,Enak tempatnya bersih nyaman dan makanan yang disajikan pun bervariasi Selain itu tempatnya yang berada di kota menjadikan tempat istirahat orang orang yang berbelanja dan pekerja kantoran Harganya memang mahal tapi setara dengan rasanya,positive
423,jadi pelajaran buat memilih pemimpin,positive
424,gunung mas ini prabowo ya gaes,neutral
425,belajar dari propinsi lampung masalah singkong itu tanaman yang tidak begitu sulit untuk budidaya nya,positive
426,berita nasional kok enggak ada yakok enggak ada foto orang sendiri di situ sampil tunjuk jari biasanya ada penampakan,neutral
427,Sangat melelahkan malam ini,negative
428,rencana repelita penguasaan lahan oleh pemerintah bukan lagi untuk rakyat kepentingan rakyat,negative
429,proyek abal abal ini mah,negative
430,hahaaha haaaalanjutkaan,negative
431,Banyak keluarga saya yang bekerja sebagai pegawai negeri,neutral
432,kasihan banget ya allah,negative
433,hutan dirusak semua iklim makin rusakhewan makin punahrakyat makin susahpenyakit semakin banyak,negative
434,akibat kerja kerja kerjatanpa mikir dahulu,negative
435,Komentar pertama sudah pasti venue yang kece pelayanan ramah sekali dan untuk menu yang dipilih adalah ikan bakar dan sop buntutnya yang aku kasih nilai tapi buat es buah itu aku kasih nilai ya,positive
436,siapa ini prabowo apa saran jokowe dibantuolehtniperusak sekali,negative
437,Bosan dengan dunia ini yang penuh dengan kemunafikan,negative
438,Sekarang restorannya bertingkat Sayangnya ketika saya ke sana acnya mati jadi gerah Dan yang membuat saya heran saya tidak pernah dikasih struk,negative
439,lestari alamkulestari desakudimana tuhan ku menitipkan akudamai saudarakusuburlah bumikukuingat ibuku dongengan ceritanusantara lama sangatlah elok dengan aneka makna,positive
440,wrong planning pemerintah,neutral
441,Tempat ini mengimingi makan steak dan daging dengan harga murah Namun kenyataannya tidak murah jika dibandingkan dengan kualitas dagingnya yang tidak enak Dagingnya keras dan rasanya hambar,negative
442,bakal penghuni lp,neutral
443,Tidak mesti di ruang tertutup buat pertemuan pertemuan di resto ini juga asik Jangan lupa memesan nasi goreng dendeng sama teh tarik,positive
444,system kebut seharimamang tidak bisaapalagi tidak melibatkan seluruh elemen masyarakat dan instansi untuk membentuk sebuah systemurusan tanaman bukan seperti membuat gedungbegitu dibuat langsung jadinamun ada perlakuan khususterutama edukasi dari staf ahli dan pelaksana petani,positive
445,proyek cuancuan hutan di babat rakyat melarat pejabat di atas bodo amat yang penting cuan cuan,negative
446,Menurut saya bebek garang ini punya varian menu bebek yang cukup banyak Saya suka perpaduan antara bebek dan sambalnya rasanya pas Untuk harga berkisar ribu dan menurut saya cukup sepadan dengan rasa dari makanan di sini,positive
447,tak bisa berkata apa miris sedihnegara yang kayak ini ternyata dipimpin oleh para perusak bukan para alhi,negative
448,Saya bukanlah penggemar berat kambing karena tidak tahan dengan baunya tapi makan di tempat ini saya seperti tidak sedang makan kambing Dagingnya empuk enak dan tidak berbau Suasana restonya pun enak dan nyaman,positive
449,kalo sudah banget banyak menghasilkan wabah keringkok masih import jal,negative
450,ini bodoh nya pemerintah kita kata rocky gerung proyek dulu baru amdal kalo sudah kadung di babat amdal buat apa fungsi amdal itu buat pertimbangan kedepan bukan buat evaluasi,negative
451,Menyesal nih gue kasih tahu loe Farrel,negative
452,hati lama ke jual juga kan sudah bersih,positive
453,Resto dengan konsep saung yang terletak di dalam komplek perumahan Makanan yang disajikan beragam mulai dari sundanese makanan barat dll udara cukup dingin di malam hari atau ketika hujan jadi disarankan membawa jaket Jalan antar saung menggunakan batu batu sehingga kadang kadang licin ketika hujan,neutral
454,rugi,negative
455,kayu nya di ambil rakyat yang di suruh kerja di abaikanhebat nya tokoh tokoh yang di beri wewenang food estate,negative
456,permainan,positive
457,petani malas,negative
458,kayu kayu nya kemana,negative
459,ya program seperti itu enggak bisa tahun langsung jadi karena program biasanya kalau berjalan terus makan waktu hinggatahun agar terlihat hasilnyakalau untuk sawah padi butuh waktu hinggatahun untuk menyesuaikan kualitas tanahnya,positive
460,Masakan india menurut ku tidak enak Terlalu banyak rempah,negative
461,nanam singkong enggak becus mau jadi presidensitu masih waras enggak,negative
462,menteri pertaniannya menteri koordinator bidang kemaritiman dan investasi indonesia di berita tak resmi mengatakan ini semua kegagalan kerjanya pak mentri pertahanan pak prabowo lucu sekali berita buatan oknum netizen yang membenci pak prabowo,negative
463,Penasaran ingin dicoba ayam yang cukup terkenal itu Siang itu sepi pesan ayam bakar Ternyata ayam bakarnya pedas Anak anak tidak bisa makan Harusnya pelayan menanyakan mau pedas atau tidak karena ada pilihan Kemudian saya minta ayam bakar yang tidak pedas Ampun Ayamnya cuma seperti digoreng terus dilumuri kecap Kami sudah hilang napsu makan,negative
464,lagian lucu teramat lucu kenapa juga menhanmentri pertahanan dikasih amanat mengelola sektor pertanianemang ada bakwan dibalik wajan gosong itumanusia itu aneeeeh aneh tapi nyata,negative
465,Ratusan rumah di medan terendam banjir,neutral
466,pola yang samadi periode kedua masa pemerintahan mereka akan membuat proyek dengan anggaran besar untuk kemudian dikorupsi beramai ramaiyang tertangkap cuma tumbal,negative
467,semoga presiden yang akan datang lebih memberi ke adilan ke rakyat bukan memberi banyak cuan ke para cukong pengusaha pengikut nyasereeem,positive
468,bismilah perubahan,positive
469,Kesal banget dari tadi jualan yakult tidak untung terus,negative
470,Tempat yang nyaman dan alami untuk membawa keluarga relaks suasana pedesaan alami Mengenalkan anak pda alam,positive
471,nanam singkong di atas batu wkwk,negative
472,yang namanya obsidian princes kok dihapus sihhhgimana dong,negative
473,yang penting bagi mereka ada proyekada proyek ada cuan,negative
474,Ini salah satu tempat yang makanannya enak dan pemandangannya sejuk dimata Buat kumpul dengan keluarga atau teman teman merupakan tempat yang cocok,positive
475,Kalau urusan makanan yang enak enak sepertinya inilah rajanya Bukan hanya makanan yang mantap tapi suasananya pun semakin hangat apalagi bersama keluarga atau teman Lagu lagunya juga menghibur banget,positive
476,Tadi katanya suruh tunggu saja sampai sms diterima sudah seharian tidak ada juga,negative
477,era presiden yang memerintahkan,neutral
478,buzzer mana buzzer,negative
479,Gojek akan mulai membuka layanan mereka di beberapa negara asia tenggara,neutral
480,ketika orang plonga plongo membuat kebijakan proyekhancur semua sih paling plonga plongo harus bertanggungjawab atas kerusakan lingkungan yang terjadi,negative
481,ide konyol harusnya mereka punya konsep seethingdo itlihat pikirkan kerjakan jangan mengerjakan tanpa dipikirkan atau jangan berpikir tanpa melihat itu pekerjaan bodoh,negative
482,Inilah mitos yang membuat tahun baru menjadi seremonial dan artifisial tanpa kedalaman makna,negative
483,Pelayanan solaria sungguh tidak memuaskan hampir di seluruh cabang yang ada di Jakarta Tidak rekomendasi banget,negative
484,rezim plonga plongo tolol,negative
485,Rumah itu memiliki pagar besar berwarna hitam,neutral
486,program nya betul untuk ketahanan pangan nasionaltapi menteri pertanian yang bodohdari partai nasdem eeemalam ketangkap kpkbegitu kok malah mau buat koalisi perubahan,negative
487,nanam singkong sampai kalimantanngawur ini pemerintah,negative
488,Pemandangan yang luar biasa dari kafe ini menyajikan sentuhan cemara dan eksotisnya alam hutan raya bandung Selain itu makanan dan minuman yang terbilang murah banget Keren,positive
489,yang penting dana pemerintah jadi cuan,negative
490,pertanyaan saya bukan mslah tanahnya tapi persiapan lahanpengelolaan lahan dan perawatan tanamannya mungkin masih ada yang kurang,negative
491,sistem memaksakan propasal jadi cuan ahli dan penijauan asal asalan,negative
492,Malas makan oreo suka bikin gigi hitam,negative
493,harus direboisasi,negative
494,ini hasil dari penguasa bajingan achir nya tanah rusak terbengkalae apa seperti ini yang akan di pilihno no no,negative
495,Aku iri melihat kalian yang bisa menemukan kebahagiaan,negative
496,pekerjaan seperti ini harus dipakai tenaga honor dari perguruan tinggi banyak yang nganggur tuh asal penghasilan sama dengan ppk kalaupun diluar kota dijamin keamanannyapasti mereka sanggup nanam padipalawijamereka akan menerapkan ilmunya dilapangan kalau misanya lulusan tekniksambil menanam bisa menerapkan ilmunya buat alat tanam cepat dan panen cepat,positive
497,Kami berkunjung ke restoran ini pada malam hari Wow tempatnya sangat romantis Lilin jalan mendaki konsep lesehan di tengah suara air terjun yang cukup dekat membuat suasana makan lebih nikmat,positive
498,viralkan,negative
499,Tiket waterboom PIK jakarta dikabarkan naik,neutral
500,Batagor kingsley sangat lezat dan disukai oleh keluarga dan warga jakarta Setiap kali pergi ke bandung keluarga dan teman teman selalu minta dibelikan batagor kingsley,positive
501,karya nyata pemerintah sekarang,neutral
502,hahacuma cn dan cnbc yang berani siarin kaya beginian,neutral
503,Pelajaran matematika anak sd sekarang sulit sulit,negative
504,program tolol,negative
505,Lokasi agak jauh dari kota bandung dan sekarang ada gerbang pembayaran untuk bisa ke the peak dengan total rupiah Ini seperti pemaksaan untuk pungutan liar karena anda tidak akan bisa ke the peak tanpa melewati kedua gerbang ini,negative
506,Enaknya makan di redsdifo baru kali ini dah saya suka banget makan ikan Ikannya segar enak dan tidak ada bau amis lagi Pokoknya ikan bawal enak Dan kopi robusta susu mantap Pokok A ketagihan dah Redsdipo jadi tempat favorit saya Enak pokoknya mah,positive
507,tangkappenjarakan oknum rakus uang rakyat untuk proyek sia sia,negative
508,yang penting dapat kayu,positive
509,ini sih mangkrak yang lebih mengerikan dibanding hambalang,negative
510,gobloknya para oknum pemerintah yang masih saja berusaha memperkaya diri sendiri dengan cara bikin proyek enggak serius,negative
511,Baik kak berkenan menunggu untuk kendala pada provider telkomsel akan direspon oleh rekan kami,neutral
512,militer di suruh nanem nyalon presiden lagi,negative
513,Makanan di sini enak loh Lebih enak ketimbang tempat makan sejenis di balikpapan Tetapi ya harganya lebih mahal juga Hhe orang jatuhnya ribuan lebih Tapi puas karena rasa makanannya enak Kuah tomyamnya Mm Enak,positive
514,Kesal bukan karena mu Tetapi persis dikalahkan pssm Tidak enak hati tidak enak tidur tidak enak makan Semua gara gara pssm,negative
515,tanah ku sewaair ku belitanah air sekarang di jual belihutan di bakarasap ku hiruplangit memerahmatahari pun meredup,negative
516,terima kasih banyak kamu tantv,positive
517,prabowo bagaimana sih ini anjir,negative
518,Kualitas lounge amat mengecewakan Jauh dari eskalator melalui lorong lorong kotor Desain sempit memanjang,negative
519,tangkap kowe,negative
520,Pagi pagi di tol cipali sudah macet parah bikin jengkel saja ini,negative
521,inilah hasil dari presiden yang sangat di banggakan dan di dewakan beserta kelompoknya yang menganut paham komunisme berkedok partai demokrasisalut dengan masyarakat yang tetap dukung walaupun faktanya kehidupan sosial susah dan carut marut,positive
522,Mimpi disuruh mencari coklat sama gordon ramsay eh malah kecampur sama kuah indomie,neutral
523,kelakuannya merusak terus,negative
524,yang penting gembar gembor di awalperesmian fotoabis itu menghilang,negative
525,Paling suka banget makan siang di sini ayam sama sambalnya enak banget harganya luar biasa hemat rasa ayamnya meresap sampai ketulangnya es lidah buayanya juga segar bikin adem perut setelah makan sambal yang pedas pelayannya sigap dan ramah yang aku suka di tempat kasir ada tulisan disumbangkan untuk beramal buat makan jadi lebih enak ke perut,positive
526,Makanan enak suasana sangat asri dan sejuk dengan banyak pepohonan dan suara air sungai yang mengalir buat tambah nyaman dan tenang Pelayanan yang cepat sehingga kita tidak menunggu lama Ada ruang salat yang nyaman Menu makanan enak harga terjangkau,positive
527,ynktsplanga plongomukidi di lawanwkwkkwkwwkwk,negative
528,Mm sedih deh kalau ke sini selalu menunggu Mienya pedas banget Hehe bangkunya juga tambahkan dong biar tidak menunggu,negative
529,asal bapak senang,positive
530,Menunggu mal istana plaza buka di pagi hari sebaiknya mampir di mangkok ayam di pelataran lantai istana plaza berbagai macam menu pilihan indonesia food chinese food tersedia Sebaiknya dicoba mi ayam rica sungguh sangat puas sembari minum kopi di pagi hari,positive
531,betul yag dikatakan salah satu dosen perempuan peneliti indonesiabanyak kebijakan itu sifatnya emosionaltidak berdasarkan kajianmaunya gaskeun akhirnya cuma buang duit rakyatmerusak lingkungan dan kehidupan masyarakat,negative
532,Sekarang bukan zaman janji Km rakyat sudah bosan alias muak,negative
533,prabowo oh prabowo,negative
534,coba kami suruh kelola kami bukan sok bisa tapi lahan exrim apapun bisa kita kelola dengan teknologi kuncinya niat awal benar atau hanya untuk cari projek,negative
535,Kamar mandi jauh dari layak untuk cuci tangan tidak disediakan sabun,negative
536,hahhakalian paling banteng mamam itu proyek,negative
537,bukti kalau kerja butuh perencanaan yang matang,neutral
538,Sudah beberapa kali makan di tempat ini Menu merupakan menu khas sunda terutama tersedia menu yang sudah jarang ditemukan di rumah makan lainnya di bandung Rasa makanan sungguh lezat,positive
539,bowo mana bowotanggung jawab sama sih jowi,negative
540,KIPP menerima banyak laporan terkait adanya pelanggaran pada pilkada,negative
541,kesalahan jokowi asal nunjuk mentriseparo mentrinya orang enggak bisa kerjaakhirnya jokowi sendiri yang kena marah rakyat,negative
542,prabowo yang bikin proyekkalo gagal jokowi yang kena getahnya,negative
543,manusia manusia itu perlu dibersihkan,negative
544,mantepmasih mau lanjutkan dari redbul,positive
545,beginilah yang terjadi ketika proyek tidak diserahkan kepada ahlinya,neutral
546,Sayangnya handphone xiaomi apa pun tidak bisa kalau cuma beli gb karena software bawaannya itu gede banget,negative
547,jokowiprabowo bertanggung jawab bukan memikirkan copras capres saja,negative
548,hutan habis lingkungan jadi buruk cuaca pun sulit di prediksi sumber air tanah pun semakin dalam kok malah hutan di babat jadi lahan ya sama saja bunuh diri,negative
549,Kotor banget dan tidak di hiraukan oleh pelayan restoran Mengecewakan sekali pelayanannya,negative
550,Temanku juga banyak yang bekerja di bukalapak,neutral
551,Pagi yang melelahkan rasanya ingin diam saja,negative
552,makan saja itu nuklir,negative
553,Tidak bosan dan terkesima Setiap datang ke congo kafe Tempatnya tenang Nyaman Coba deh datang malam hari Lebih romantis Kalau bawa pasangan,positive
554,maju terus korut,positive
555,Makan di sini cukup nikmat karena menunya beragam dari mulai menu indonesia asia hingga tiongkok Sehingga bisa mencoba rasa yang beragam Rasanya juga tidak kalah enak Tempatnya cukup nyaman pelayanannya pun cepat,positive
